{
  "schema_version": "1.0",
  "protocol": "koni.parity-proofs.v1",
  "principle": "Every assertion binds exact executable tests or an explicit fail-closed Core blocker; a test name is evidence only when that mapped test process succeeds.",
  "proofs": [
    {
      "case_id": "KPAR-BRK-0001",
      "assertion_id": "A01-valid-once",
      "checkpoint": "C01-enforced",
      "contract_sha256": "derived",
      "comparison": "semantic-oracle-contract",
      "target_tests": [
        {
          "file": "packages/core/test/grants.test.ts",
          "title": "returns the exact durable result for an idempotent replay"
        },
        {
          "file": "packages/core/test/grants.test.ts",
          "title": "allows a session to chain later calls from authority-returned CAS state"
        }
      ],
      "oracle_test": "broker_receipt_matrix_covers_worker_and_lead_replay_boundaries"
    },
    {
      "case_id": "KPAR-BRK-0001",
      "assertion_id": "A02-invalid-no-effect",
      "checkpoint": "C01-enforced",
      "contract_sha256": "derived",
      "comparison": "semantic-oracle-contract",
      "target_tests": [
        {
          "file": "packages/core/test/grants.test.ts",
          "title": "rejects reuse of a call id with different arguments"
        },
        {
          "file": "packages/core/test/grants.test.ts",
          "title": "rejects cross-session and out-of-scope calls"
        },
        {
          "file": "packages/core/test/path-policy.test.ts",
          "title": "rejects stale writes, symlinks, escapes, and compiler-owned paths"
        }
      ],
      "oracle_test": "compiled_member_definition_drift_and_unsafe_replay_fail_closed"
    },
    {
      "case_id": "KPAR-BRK-0001",
      "assertion_id": "A03-terminal-closed",
      "checkpoint": "C01-enforced",
      "contract_sha256": "derived",
      "comparison": "semantic-oracle-contract",
      "target_tests": [
        {
          "file": "scripts/parity-fixtures.test.ts",
          "title": "rejects the exact grant and call replay after terminal revocation"
        }
      ],
      "oracle_test": "broker_revocation_marks_in_flight_pending_and_never_waits_on_operation_lock"
    },
    {
      "case_id": "KPAR-CFG-0001",
      "assertion_id": "A01-profile-valid",
      "checkpoint": "C01-installed",
      "contract_sha256": "derived",
      "comparison": "semantic-oracle-contract",
      "target_tests": [
        {
          "file": "packages/core/test/profile-install.test.ts",
          "title": "materializes a verified profile without changing Pi settings"
        }
      ],
      "oracle_capture_command": "install-software"
    },
    {
      "case_id": "KPAR-CFG-0001",
      "assertion_id": "A02-pi-preserved",
      "checkpoint": "C01-installed",
      "contract_sha256": "derived",
      "comparison": "semantic-specification-contract",
      "target_tests": [
        {
          "file": "packages/core/test/profile-install.test.ts",
          "title": "materializes a verified profile without changing Pi settings"
        }
      ]
    },
    {
      "case_id": "KPAR-CFG-0002",
      "assertion_id": "A01-profile-valid",
      "checkpoint": "C01-installed",
      "contract_sha256": "derived",
      "comparison": "semantic-oracle-contract",
      "target_tests": [
        {
          "file": "packages/core/test/rule-compiler.test.ts",
          "title": "projects both frozen profile registries into directly consumable graph schemas"
        },
        {
          "file": "packages/research-profile/test/profile.test.ts",
          "title": "defines every node for agents with a nonempty semantic description"
        }
      ],
      "oracle_test": "bundled_research_inventory_enforces_empirical_experiment_ontology"
    },
    {
      "case_id": "KPAR-CFG-0002",
      "assertion_id": "A02-reciprocal-edges",
      "checkpoint": "C01-installed",
      "contract_sha256": "derived",
      "comparison": "semantic-oracle-contract",
      "target_tests": [
        {
          "file": "packages/research-profile/test/profile.test.ts",
          "title": "stores each reciprocal research fact once through canonical bidirectional edges"
        },
        {
          "file": "packages/core/test/typed-graph.test.ts",
          "title": "stores one canonical edge while traversing both directions"
        }
      ],
      "oracle_test": "bidirectional_edge_uses_one_canonical_declaration_and_inverse_alias"
    },
    {
      "case_id": "KPAR-CFG-0003",
      "assertion_id": "A01-overlay-preserved",
      "checkpoint": "C01-upgraded",
      "contract_sha256": "derived",
      "comparison": "semantic-specification-contract",
      "target_tests": [
        {
          "file": "packages/core/test/profile-install.test.ts",
          "title": "three-way merges changed defaults while preserving edits, deletions, and additions"
        }
      ]
    },
    {
      "case_id": "KPAR-CFG-0003",
      "assertion_id": "A02-state-preserved",
      "checkpoint": "C01-upgraded",
      "contract_sha256": "derived",
      "comparison": "semantic-specification-contract",
      "target_tests": [
        {
          "file": "scripts/parity-fixtures.test.ts",
          "title": "preserves authority run state byte-for-byte across a signed baseline upgrade"
        }
      ]
    },
    {
      "case_id": "KPAR-GIT-0001",
      "assertion_id": "A01-no-auto-merge",
      "checkpoint": "C01-ready",
      "contract_sha256": "derived",
      "comparison": "semantic-oracle-contract",
      "target_tests": [
        {
          "file": "packages/core/test/isolated-git-lifecycle.test.ts",
          "title": "keeps target promotion explicit, rejects target movement, and never overwrites a dirty target checkout"
        }
      ],
      "oracle_test": "promotion_rejects_a_run_ref_advance_after_preflight"
    },
    {
      "case_id": "KPAR-GIT-0001",
      "assertion_id": "A02-explicit-merge",
      "checkpoint": "C02-merged",
      "contract_sha256": "derived",
      "comparison": "semantic-oracle-contract",
      "target_tests": [
        {
          "file": "packages/core/test/isolated-git-lifecycle.test.ts",
          "title": "keeps target promotion explicit, rejects target movement, and never overwrites a dirty target checkout"
        }
      ],
      "oracle_test": "approval_creates_first_permanent_run_ref_and_removes_planning_checkout"
    },
    {
      "case_id": "KPAR-GIT-0002",
      "assertion_id": "A01-history-preserved",
      "checkpoint": "C01-conflict",
      "contract_sha256": "derived",
      "comparison": "semantic-oracle-contract",
      "target_tests": [
        {
          "file": "packages/core/test/isolated-git-lifecycle.test.ts",
          "title": "turns target merge conflicts into integration work without changing the target"
        }
      ],
      "oracle_test": "conflicting_squash_reports_all_sides_without_touching_integration"
    },
    {
      "case_id": "KPAR-GIT-0002",
      "assertion_id": "A02-one-resolver",
      "checkpoint": "C01-conflict",
      "contract_sha256": "derived",
      "comparison": "semantic-oracle-contract",
      "target_tests": [
        {
          "file": "packages/core/test/run-authority-engine.test.ts",
          "title": "creates one bounded integration ticket for a target conflict without resolver chains"
        }
      ],
      "oracle_test": "terminal_recovery_dispatch_suppresses_resolver_chains"
    },
    {
      "case_id": "KPAR-LIF-0001",
      "assertion_id": "A01-pause-durable",
      "checkpoint": "C01-resumed",
      "contract_sha256": "derived",
      "comparison": "semantic-oracle-contract",
      "target_tests": [
        {
          "file": "packages/core/test/run-lifecycle.test.ts",
          "title": "persists pause intent and resumes only explicitly"
        },
        {
          "file": "packages/core/test/pi-managed-session.test.ts",
          "title": "keeps pause admission closed until an explicit resume"
        }
      ],
      "oracle_test": "lifecycle_play_pause_intent_round_trips_independently_of_orchestration"
    },
    {
      "case_id": "KPAR-LIF-0001",
      "assertion_id": "A02-zero-paused-usage",
      "checkpoint": "C01-resumed",
      "contract_sha256": "derived",
      "comparison": "semantic-oracle-contract",
      "target_tests": [
        {
          "file": "packages/core/test/run-authority-engine.test.ts",
          "title": "keeps paused usage at zero across restart and creates only one resume successor"
        }
      ],
      "oracle_test": "planning_pause_wins_while_launcher_runs_without_semantic_completion"
    },
    {
      "case_id": "KPAR-LIF-0001",
      "assertion_id": "A03-resume-once",
      "checkpoint": "C01-resumed",
      "contract_sha256": "derived",
      "comparison": "semantic-oracle-contract",
      "target_tests": [
        {
          "file": "packages/core/test/run-authority-engine.test.ts",
          "title": "keeps paused usage at zero across restart and creates only one resume successor"
        }
      ],
      "oracle_test": "selected_run_play_pause_is_durable_across_planning_and_active_phases"
    },
    {
      "case_id": "KPAR-LIF-0002",
      "assertion_id": "A01-all-aborted",
      "checkpoint": "C01-deleted",
      "contract_sha256": "derived",
      "comparison": "semantic-oracle-contract",
      "target_tests": [
        {
          "file": "packages/core/test/pi-attempt-process.test.ts",
          "title": "run deletion cannot leave any concurrently active attempt process alive"
        },
        {
          "file": "packages/core/test/pi-attempt-process.test.ts",
          "title": "kills descendants in the same attempt process group"
        }
      ],
      "oracle_test": "direct_pi_exit_refuses_deleted_unregistered_concluded_or_missing_control_state"
    },
    {
      "case_id": "KPAR-LIF-0002",
      "assertion_id": "A02-no-late-effects",
      "checkpoint": "C01-deleted",
      "contract_sha256": "derived",